{
  "id": "image-top",
  "name": "Image Top",
  "category": "content",
  "description": "Title at top, large image in the middle (50% height), body text below. Use when the image is the main focus and needs brief explanation underneath.",
  "regions": [
    {
      "id": "heading",
      "role": "heading",
      "bounds": { "x": 0, "y": 0, "w": 1136, "h": 40 },
      "align": { "horizontal": "left", "vertical": "top" },
      "fontSize": "h1",
      "maxLines": 1
    },
    {
      "id": "image",
      "role": "image",
      "bounds": { "x": 0, "y": 56, "w": 1136, "h": 300 },
      "align": { "horizontal": "center", "vertical": "middle" },
      "optional": true
    },
    {
      "id": "body",
      "role": "body",
      "bounds": { "x": 0, "y": 376, "w": 1136, "h": 200 },
      "align": { "horizontal": "left", "vertical": "top" },
      "fontSize": "body"
    }
  ]
}
