{
  "id": "image-right",
  "name": "Image Right",
  "category": "content",
  "description": "Full-width heading at top, then body text on the left and image on the right below. Mirror of image-left.",
  "regions": [
    {
      "id": "heading",
      "role": "heading",
      "bounds": { "x": 0, "y": 0, "w": 1136, "h": 40 },
      "align": { "horizontal": "left", "vertical": "top" },
      "fontSize": "h1"
    },
    {
      "id": "body",
      "role": "body",
      "bounds": { "x": 0, "y": 60, "w": 520, "h": 520 },
      "align": { "horizontal": "left", "vertical": "top" },
      "fontSize": "body"
    },
    {
      "id": "image",
      "role": "image",
      "bounds": { "x": 568, "y": 60, "w": 568, "h": 520 },
      "align": { "horizontal": "center", "vertical": "middle" },
      "optional": true
    }
  ]
}
